id	src tokenized	tgt tokenized	src raw	tgt raw	NOUN VERB	nsubj ROOT
415	"@Bartender_Rott ""H-haaah... yes... I d-did... Fuck..."" Tyler whimpered, biting his lower lip as his back arched, that fat thumb touching his sensitive folds making his eyes flutter shut.Some more of that glistening liquid dripped out of the boy's blossomi"	"[""@Bartender_Rott"", """"H-haaah..."", ""yes..."", ""I"", ""d-did..."", ""Fuck..."""", ""Tyler"", ""whimpered,"", ""biting"", ""his"", ""lower"", ""lip"", ""as"", ""his"", ""back"", ""arched,"", ""that"", ""fat"", ""thumb"", ""touching"", ""his"", ""sensitive"", ""folds"", ""making"", ""his"", ""eyes"", ""flutter"", ""shut.Some"", ""more"", ""of"", ""that"", ""glistening"", ""liquid"", ""dripped"", ""out"", ""of"", ""the"", ""boy's"", ""blossoming"", ""cunt,"", ""the"", ""pink"", ""flesh"", ""inside"", ""shiny"", ""&gt;""]"	"@Bartender_Rott ""H-haaah... yes... I d-did... Fuck..."" Tyler whimpered, biting his lower lip as his back arched, that fat thumb touching his sensitive folds making his eyes flutter shut.Some more of that glistening liquid dripped out of the boy's blossomi"	"@Bartender_Rott ""H-haaah... yes... I d-did... Fuck..."" Tyler whimpered, biting his lower lip as his back arched, that fat thumb touching his sensitive folds making his eyes flutter shut.Some more of that glistening liquid dripped out of the boy's blossomi"	PUNCT PROPN PUNCT PUNCT PROPN PUNCT PROPN PUNCT INTJ PUNCT PRON VERB PUNCT VERB PUNCT NOUN PUNCT PUNCT PUNCT PROPN VERB PUNCT VERB PRON ADJ NOUN SCONJ PRON NOUN VERB PUNCT SCONJ ADJ NOUN VERB PRON ADJ NOUN VERB PRON NOUN NOUN VERB PUNCT DET ADJ ADP DET VERB NOUN VERB ADP ADP DET NOUN PART NOUN PUNCT	punct ROOT punct punct compound punct appos punct ROOT punct ROOT appos punct conj punct ROOT punct punct punct nsubj appos punct advcl poss amod dobj mark poss nsubj advcl punct det amod dobj acl poss amod dobj xcomp poss nsubj ccomp ccomp punct det nsubj prep det amod pobj ROOT prep prep det poss case pobj punct
416	"@OdunadekoladeHappy birthday to you, may God continue to shower His infinite blessings on you and your family"	"[""@OdunadekoladeHappy"", ""birthday"", ""to"", ""you,"", ""may"", ""God"", ""continue"", ""to"", ""shower"", ""His"", ""infinite"", ""blessings"", ""on"", ""you"", ""and"", ""your"", ""family""]"	"@OdunadekoladeHappy birthday to you, may God continue to shower His infinite blessings on you and your family"	"@OdunadekoladeHappy birthday to you, may God continue to shower His infinite blessings on you and your family"	PUNCT ADJ NOUN ADP PRON PUNCT AUX PROPN VERB PART VERB PRON ADJ NOUN ADP PRON CCONJ PRON NOUN PUNCT	punct amod npadvmod prep pobj punct aux nsubj ROOT aux xcomp poss amod dobj prep pobj cc poss conj punct
417	@MirrorCeleb I'm just waiting to hear about the 2020 version of the Oedipus complex: the child's repressed desire to transition their single parent dad into a mother in order to sleep with ...them. Or maybe it's the other way round now. I can't keep up. L	"[""@MirrorCeleb"", ""I'm"", ""just"", ""waiting"", ""to"", ""hear"", ""about"", ""the"", ""version"", ""of"", ""the"", ""Oedipus"", ""complex:"", ""the"", ""child's"", ""repressed"", ""desire"", ""to"", ""transition"", ""their"", ""single"", ""parent"", ""dad"", ""into"", ""a"", ""mother"", ""in"", ""order"", ""to"", ""sleep"", ""with"", ""...them."", ""Or"", ""maybe"", ""it's"", ""the"", ""other"", ""way"", ""round"", ""now."", ""I"", ""can't"", ""keep"", ""up."", ""Love"", ""is"", ""love""]"	@MirrorCeleb I'm just waiting to hear about the 2020 version of the Oedipus complex: the child's repressed desire to transition their single parent dad into a mother in order to sleep with ...them. Or maybe it's the other way round now. I can't keep up. L	@MirrorCeleb I'm just waiting to hear about the 2020 version of the Oedipus complex: the child's repressed desire to transition their single parent dad into a mother in order to sleep with ...them. Or maybe it's the other way round now. I can't keep up. L	INTJ PRON AUX ADV VERB PART VERB ADP DET NUM NOUN ADP DET PROPN NOUN PUNCT DET NOUN PART ADJ NOUN PART VERB PRON ADJ NOUN NOUN ADP DET NOUN ADP NOUN PART VERB ADP PUNCT PRON PUNCT CCONJ ADV PRON AUX DET ADJ NOUN ADV ADV PUNCT PRON AUX PART VERB ADP PUNCT NOUN	ROOT nsubj aux advmod ROOT aux xcomp prep det nummod pobj prep det compound pobj punct det poss case amod dobj aux acl poss amod compound dobj prep det pobj prep pobj aux acl prep punct appos punct cc advmod nsubj ROOT det amod attr advmod advmod punct nsubj aux neg ROOT prt punct ROOT
418	"@TheActivistOBT @iamjondraper Yes, severity. And I agree with you but I don't give a fuck what the numbers say.  The fact remains that if a film crew breaks out then the film is shut down until they have recovered. I would like to go to a movie theater ag"	"[""@TheActivistOBT"", ""@iamjondraper"", ""Yes,"", ""severity."", ""And"", ""I"", ""agree"", ""with"", ""you"", ""but"", ""I"", ""don't"", ""give"", ""a"", ""fuck"", ""what"", ""the"", ""numbers"", ""say."", ""The"", ""fact"", ""remains"", ""that"", ""if"", ""a"", ""film"", ""crew"", ""breaks"", ""out"", ""then"", ""the"", ""film"", ""is"", ""shut"", ""down"", ""until"", ""they"", ""have"", ""recovered."", ""I"", ""would"", ""like"", ""to"", ""go"", ""to"", ""a"", ""movie"", ""theater"", ""again"", ""to"", ""see"", ""something"", ""other"", ""than"", ""a"", ""year"", ""old"", ""movie.""]"	"@TheActivistOBT @iamjondraper Yes, severity. And I agree with you but I don't give a fuck what the numbers say.  The fact remains that if a film crew breaks out then the film is shut down until they have recovered. I would like to go to a movie theater ag"	"@TheActivistOBT @iamjondraper Yes, severity. And I agree with you but I don't give a fuck what the numbers say.  The fact remains that if a film crew breaks out then the film is shut down until they have recovered. I would like to go to a movie theater ag"	PUNCT PROPN PROPN INTJ PUNCT NOUN PUNCT CCONJ PRON VERB ADP PRON CCONJ PRON AUX PART VERB DET NOUN PRON DET NOUN VERB PUNCT SPACE DET NOUN VERB SCONJ SCONJ DET NOUN NOUN VERB ADP ADV DET NOUN AUX VERB ADP SCONJ PRON AUX VERB PUNCT PRON AUX VERB PART VERB ADP DET NOUN NOUN NOUN PUNCT	punct ROOT punct intj punct ROOT punct cc nsubj ROOT prep pobj cc nsubj aux neg ROOT det dobj dobj det nsubj ccomp punct dep det nsubj ROOT mark mark det compound nsubj advcl prt advmod det nsubjpass auxpass ccomp prt mark nsubj aux advcl punct nsubj aux ROOT aux xcomp prep det compound compound pobj punct
419	@DeaconPaulC @THEBLANKETSTAC1 @SchoolboyOwn @scottblue66 @Noble67Allan @Pusser14405122 @Bruce437t @Jamespa97888596 @bmstewart2004 @seatedskydiver That's why I'm so proud of the work we do in @navy_women today	"[""@DeaconPaulC"", ""@THEBLANKETSTAC1"", ""@SchoolboyOwn"", ""@scottblue66"", ""@Noble67Allan"", ""@Pusser14405122"", ""@Bruce437t"", ""@Jamespa97888596"", ""@bmstewart2004"", ""@seatedskydiver"", ""That's"", ""why"", ""I'm"", ""so"", ""proud"", ""of"", ""the"", ""work"", ""we"", ""do"", ""in"", ""@navy_women"", ""today""]"	@DeaconPaulC @THEBLANKETSTAC1 @SchoolboyOwn @scottblue66 @Noble67Allan @Pusser14405122 @Bruce437t @Jamespa97888596 @bmstewart2004 @seatedskydiver That's why I'm so proud of the work we do in @navy_women today	@DeaconPaulC @THEBLANKETSTAC1 @SchoolboyOwn @scottblue66 @Noble67Allan @Pusser14405122 @Bruce437t @Jamespa97888596 @bmstewart2004 @seatedskydiver That's why I'm so proud of the work we do in @navy_women today	PROPN PROPN VERB NOUN PROPN NOUN PUNCT NOUN X PROPN PROPN PRON AUX SCONJ PRON AUX ADV ADJ ADP DET NOUN PRON VERB ADP NOUN NOUN	compound nsubj ROOT compound compound punct ROOT dep dep compound punct nsubj ROOT advmod nsubj ccomp advmod acomp prep det pobj nsubj relcl prep pobj npadvmod
420	"This was posted on my Instagram in 2013So no, it has nothing to do with the @FBI or #gamergate #repost#happyveteransday yay #noschool#thankyou#emts#doctors#soldiers#marine#navy#army#airforce#veterans#police#government for #fighting for #our#freedomhttps://t.co/ZXsRFS7Atn https://t.co/MUaNHQLDTc"	"[""This"", ""was"", ""posted"", ""on"", ""my"", ""Instagram"", ""in"", ""2013So"", ""no,"", ""it"", ""has"", ""nothing"", ""to"", ""do"", ""with"", ""the"", ""@FBI"", ""or"", ""#gamergate"", ""#repost#happyveteransday"", ""yay"", ""#noschool#thankyou#emts#doctors#soldiers#marine#navy#army#airforce#veterans#police#government"", ""for"", ""#fighting"", ""for"", ""#our#freedomhttps://t.co/ZXsRFS7Atn"", ""https://t.co/MUaNHQLDTc""]"	"This was posted on my Instagram in 2013So no, it has nothing to do with the @FBI or #gamergate #repost#happyveteransday yay #noschool#thankyou#emts#doctors#soldiers#marine#navy#army#airforce#veterans#police#government for #fighting for #our#freedomhttps://t.co/ZXsRFS7Atn https://t.co/MUaNHQLDTc"	"This was posted on my Instagram in 2013So no, it has nothing to do with the @FBI or #gamergate #repost#happyveteransday yay #noschool#thankyou#emts#doctors#soldiers#marine#navy#army#airforce#veterans#police#government for #fighting for #our#freedomhttps://t.co/ZXsRFS7Atn https://t.co/MUaNHQLDTc"	PUNCT PRON AUX VERB ADP PRON PROPN ADP NUM NOUN PUNCT PRON VERB PRON PART VERB ADP DET ADJ CCONJ ADV VERB SYM NOUN NOUN SYM NOUN ADP NOUN VERB ADP SYM NOUN SYM ADJ PROPN PUNCT	punct nsubjpass auxpass ccomp prep poss pobj prep nummod pobj punct nsubj ccomp dobj aux relcl prep det pobj cc conj nmod det compound dobj dep ROOT prep pobj pobj prep nmod amod punct amod pobj punct
421	@FamilyManHays Whooooo once in million that happens y'all get hella happy  like fam y'all need to chill man this hilarious URL literally damn if you damn if you don't URL literally has to be that A+plus student for Life but if they get A- it's problems in	"[""@FamilyManHays"", ""Whooooo"", ""once"", ""in"", ""million"", ""that"", ""happens"", ""y'all"", ""get"", ""hella"", ""happy"", ""like"", ""fam"", ""y'all"", ""need"", ""to"", ""chill"", ""man"", ""this"", ""hilarious"", ""URL"", ""literally"", ""damn"", ""if"", ""you"", ""damn"", ""if"", ""you"", ""don't"", ""URL"", ""literally"", ""has"", ""to"", ""be"", ""that"", ""A+plus"", ""student"", ""for"", ""Life"", ""but"", ""if"", ""they"", ""get"", ""A-"", ""it's"", ""problems"", ""in"", ""the"", ""house"", ""lol."", ""https://t.co/Ub2GlpKvMM""]"	@FamilyManHays Whooooo once in million that happens y'all get hella happy  like fam y'all need to chill man this hilarious URL literally damn if you damn if you don't URL literally has to be that A+plus student for Life but if they get A- it's problems in	@FamilyManHays Whooooo once in million that happens y'all get hella happy  like fam y'all need to chill man this hilarious URL literally damn if you damn if you don't URL literally has to be that A+plus student for Life but if they get A- it's problems in	VERB PROPN ADV ADP NUM PRON VERB PRON PRON VERB PROPN ADJ SPACE INTJ PROPN PRON PRON VERB PART VERB NOUN DET ADJ NOUN ADV ADV SCONJ PRON VERB SCONJ PRON AUX PART NOUN ADV VERB PART AUX DET ADJ NOUN ADP PROPN CCONJ SCONJ PRON VERB NOUN PRON AUX NOUN ADP	advcl nsubj advmod prep pobj nsubj advcl nsubj appos ccomp nsubj ccomp dep prep pobj nsubj appos ROOT aux xcomp dobj det amod dobj advmod dep mark nsubj advcl mark poss aux neg nsubj advmod ccomp aux xcomp det amod attr prep pobj cc mark nsubj advcl dobj nsubj conj attr prep
422	"If that's my child being hit, I'm coming down to the field to sodomize him (the coach). Maybe that'll teach him to chill out https://t.co/H4S1UtIMTe"	"[""If"", ""that's"", ""my"", ""child"", ""being"", ""hit,"", ""I'm"", ""coming"", ""down"", ""to"", ""the"", ""field"", ""to"", ""sodomize"", ""him"", ""(the"", ""coach)."", ""Maybe"", ""that'll"", ""teach"", ""him"", ""to"", ""chill"", ""out"", ""https://t.co/H4S1UtIMTe""]"	"If that's my child being hit, I'm coming down to the field to sodomize him (the coach). Maybe that'll teach him to chill out https://t.co/H4S1UtIMTe"	"If that's my child being hit, I'm coming down to the field to sodomize him (the coach). Maybe that'll teach him to chill out https://t.co/H4S1UtIMTe"	PUNCT SCONJ PRON AUX PRON NOUN AUX VERB PUNCT PRON AUX VERB ADP ADP DET NOUN PART VERB PRON PUNCT DET NOUN PUNCT PUNCT ADV PRON AUX VERB PRON PART VERB ADP NOUN PUNCT	punct mark nsubj advcl poss nsubjpass auxpass attr punct nsubj aux ROOT prt prep det pobj aux advcl dobj punct det appos punct punct advmod nsubj aux ROOT dobj aux xcomp prt dobj punct
423	"Baby boy, this is what you get when you tease me, the dom says, rubbing his cock as he watches his baby squirm against his restraints. ""I'm sorry, daddy, please just let me cum."" The dom just grabs their baby's throat, looks into his eyes, and says, ""I don't think so."""	"[""Baby"", ""boy,"", ""this"", ""is"", ""what"", ""you"", ""get"", ""when"", ""you"", ""tease"", ""me,"", ""the"", ""dom"", ""says,"", ""rubbing"", ""his"", ""cock"", ""as"", ""he"", ""watches"", ""his"", ""baby"", ""squirm"", ""against"", ""his"", ""restraints."", """"I'm"", ""sorry,"", ""daddy,"", ""please"", ""just"", ""let"", ""me"", ""cum."""", ""The"", ""dom"", ""just"", ""grabs"", ""their"", ""baby's"", ""throat,"", ""looks"", ""into"", ""his"", ""eyes,"", ""and"", ""says,"", """"I"", ""don't"", ""think"", ""so.""""]"	"Baby boy, this is what you get when you tease me, the dom says, rubbing his cock as he watches his baby squirm against his restraints. ""I'm sorry, daddy, please just let me cum."" The dom just grabs their baby's throat, looks into his eyes, and says, ""I don't think so."""	"Baby boy, this is what you get when you tease me, the dom says, rubbing his cock as he watches his baby squirm against his restraints. ""I'm sorry, daddy, please just let me cum."" The dom just grabs their baby's throat, looks into his eyes, and says, ""I don't think so."""	PUNCT PROPN NOUN PUNCT PRON AUX PRON PRON VERB SCONJ PRON VERB PRON PUNCT DET NOUN VERB PUNCT VERB PRON NOUN SCONJ PRON VERB PRON NOUN ADJ ADP PRON NOUN PUNCT PUNCT PUNCT PRON AUX ADJ PUNCT NOUN PUNCT INTJ ADV VERB PRON NOUN PUNCT PUNCT PUNCT DET NOUN ADV VERB PRON NOUN PART NOUN PUNCT VERB ADP PRON NOUN PUNCT CCONJ VERB PUNCT PUNCT PUNCT PRON AUX PART VERB ADV PUNCT PUNCT PUNCT PUNCT	punct compound npadvmod punct nsubj ccomp dobj nsubj ccomp advmod nsubj advcl dobj punct det nsubj ROOT punct advcl poss dobj mark nsubj advcl poss dobj dep prep poss pobj punct punct punct nsubj ccomp acomp punct intj punct intj advmod ROOT nsubj ccomp punct punct punct det nsubj advmod ROOT poss poss case dobj punct conj prep poss pobj punct cc conj punct punct punct nsubj aux neg ccomp advmod punct ROOT punct punct
424	@adchnn Have you seen that one doujin where he got gangbanged tho	"[""@adchnn"", ""Have"", ""you"", ""seen"", ""that"", ""one"", ""doujin"", ""where"", ""he"", ""got"", ""gangbanged"", ""tho""]"	@adchnn Have you seen that one doujin where he got gangbanged tho	@adchnn Have you seen that one doujin where he got gangbanged tho	NOUN AUX PRON VERB SCONJ NUM NOUN SCONJ PRON AUX VERB NOUN	npadvmod aux nsubj ROOT det nummod dobj advmod nsubjpass auxpass relcl dobj
425	@KFILE Oh my. Thx for sharing this beautiful little lady's journey.  Peace and blessings as your carry her spirit w you.  always.	"[""@KFILE"", ""Oh"", ""my."", ""Thx"", ""for"", ""sharing"", ""this"", ""beautiful"", ""little"", ""lady's"", ""journey."", ""Peace"", ""and"", ""blessings"", ""as"", ""your"", ""carry"", ""her"", ""spirit"", ""w"", ""you."", ""always.""]"	@KFILE Oh my. Thx for sharing this beautiful little lady's journey.  Peace and blessings as your carry her spirit w you.  always.	@KFILE Oh my. Thx for sharing this beautiful little lady's journey.  Peace and blessings as your carry her spirit w you.  always.	PROPN INTJ INTJ PUNCT PROPN ADP VERB DET ADJ ADJ NOUN PART NOUN PUNCT SPACE NOUN CCONJ NOUN SCONJ PRON VERB PRON NOUN ADP PRON PUNCT SPACE ADV PUNCT	ROOT intj appos punct ROOT prep pcomp det amod amod poss case dobj punct dep ROOT cc conj mark nsubj advcl poss dobj prep pobj punct dep ROOT punct
426	"ladies is it hot that i'm good at geoguessr? wilbur i don't like men, but yes i find it attractive"	"[""""ladies"", ""is"", ""it"", ""hot"", ""that"", ""i'm"", ""good"", ""at"", ""geoguessr?"""""", ""wilbur"", ""i"", ""don't"", ""like"", ""men,"", ""but"", ""yes"", ""i"", ""find"", ""it"", ""attractive""""]"	"ladies is it hot that i'm good at geoguessr? wilbur i don't like men, but yes i find it attractive"	"ladies is it hot that i'm good at geoguessr?"" wilbur i don't like men, but yes i find it attractive"	PUNCT NOUN AUX PRON ADJ SCONJ PRON AUX ADJ ADP PROPN PUNCT PROPN PRON AUX PART VERB NOUN PUNCT CCONJ INTJ PRON VERB PRON ADJ PUNCT	punct nsubj ROOT nsubj acomp mark nsubj ccomp acomp prep pobj punct npadvmod nsubj aux neg ROOT dobj punct cc intj nsubj ROOT nsubj ccomp punct
427	"LADY BOSS SOCIAL An intimate x interactive business event with REAL inspiration, ESSENTIAL lessons and VALUABLE advice from women entrepreneurs for today's LADY BOSS; allowing for AUTHENTIC connections and CULTIVATED collaborations.JOIN THE WAIT LIST.https://t.co/XwuQjlCmsM https://t.co/YkOI17M4vC"	"[""LADY"", ""BOSS"", ""SOCIAL"", ""An"", ""intimate"", ""x"", ""interactive"", ""business"", ""event"", ""with"", ""REAL"", ""inspiration,"", ""ESSENTIAL"", ""lessons"", ""and"", ""VALUABLE"", ""advice"", ""from"", ""women"", ""entrepreneurs"", ""for"", ""today's"", ""LADY"", ""BOSS;"", ""allowing"", ""for"", ""AUTHENTIC"", ""connections"", ""and"", ""CULTIVATED"", ""collaborations.JOIN"", ""THE"", ""WAIT"", ""LIST.https://t.co/XwuQjlCmsM"", ""https://t.co/YkOI17M4vC""]"	"LADY BOSS SOCIAL An intimate x interactive business event with REAL inspiration, ESSENTIAL lessons and VALUABLE advice from women entrepreneurs for today's LADY BOSS; allowing for AUTHENTIC connections and CULTIVATED collaborations.JOIN THE WAIT LIST.https://t.co/XwuQjlCmsM https://t.co/YkOI17M4vC"	"LADY BOSS SOCIAL An intimate x interactive business event with REAL inspiration, ESSENTIAL lessons and VALUABLE advice from women entrepreneurs for today's LADY BOSS; allowing for AUTHENTIC connections and CULTIVATED collaborations.JOIN THE WAIT LIST.https://t.co/XwuQjlCmsM https://t.co/YkOI17M4vC"	PUNCT NOUN NOUN VERB DET ADJ SYM ADJ NOUN NOUN ADP PROPN NOUN PUNCT PROPN NOUN CCONJ PROPN NOUN ADP NOUN NOUN ADP NOUN PART NOUN NOUN PUNCT VERB ADP NOUN NOUN CCONJ ADJ NOUN PUNCT PROPN DET PROPN X NOUN PUNCT	punct compound nsubj ROOT det amod punct amod compound dobj prep compound pobj punct compound conj cc compound conj prep compound pobj prep poss case compound pobj punct acl prep compound pobj cc amod conj punct ROOT det appos prep npadvmod punct
428	"@lms72 @washingtonpost Why do you believe a judge (or AG) would violate his sworn oath of office and rule on politics rather than the law? Seriously. Is that what you do? These women and men decide on evidence, not shouting from pols. Don't suppose others"	"[""@lms72"", ""@washingtonpost"", ""Why"", ""do"", ""you"", ""believe"", ""a"", ""judge"", ""(or"", ""AG)"", ""would"", ""violate"", ""his"", ""sworn"", ""oath"", ""of"", ""office"", ""and"", ""rule"", ""on"", ""politics"", ""rather"", ""than"", ""the"", ""law?"", ""Seriously."", ""Is"", ""that"", ""what"", ""you"", ""do?"", ""These"", ""women"", ""and"", ""men"", ""decide"", ""on"", ""evidence,"", ""not"", ""shouting"", ""from"", ""pols."", ""Don't"", ""suppose"", ""others"", ""lie."", ""It"", ""is"", ""unwarranted,"", ""and"", ""I"", ""bet"", ""you"", ""know"", ""that""]"	"@lms72 @washingtonpost Why do you believe a judge (or AG) would violate his sworn oath of office and rule on politics rather than the law? Seriously. Is that what you do? These women and men decide on evidence, not shouting from pols. Don't suppose others"	"@lms72 @washingtonpost Why do you believe a judge (or AG) would violate his sworn oath of office and rule on politics rather than the law? Seriously. Is that what you do? These women and men decide on evidence, not shouting from pols. Don't suppose others"	PUNCT NOUN PROPN SCONJ AUX PRON VERB DET NOUN PUNCT CCONJ PROPN PUNCT AUX VERB PRON VERB NOUN ADP NOUN CCONJ NOUN ADP NOUN ADV ADP DET NOUN PUNCT ADV PUNCT AUX PRON PRON PRON VERB PUNCT DET NOUN CCONJ NOUN VERB ADP NOUN PUNCT PART VERB ADP NOUN PUNCT AUX PART VERB NOUN PUNCT	punct compound meta advmod aux nsubj ROOT det nsubj punct cc conj punct aux ccomp poss amod dobj prep pobj cc conj prep pobj advmod cc det pobj punct ROOT punct ROOT nsubj dobj nsubj ccomp punct det nsubj cc conj ROOT prep pobj punct neg xcomp prep pobj punct aux neg ROOT dobj punct
429	Like it's literally not my fault I'm ugly & im sorry that I can't be this masculine child that you want. :/	"[""Like"", ""it's"", ""literally"", ""not"", ""my"", ""fault"", ""I'm"", ""ugly"", ""im"", ""sorry"", ""that"", ""I"", ""can't"", ""be"", ""this"", ""masculine"", ""child"", ""that"", ""you"", ""want.""]"	Like it's literally not my fault I'm ugly & im sorry that I can't be this masculine child that you want. :/	Like it's literally not my fault I'm ugly & im sorry that I can't be this masculine child that you want. :/	SCONJ PRON AUX ADV PART PRON NOUN PRON AUX ADJ CCONJ PRON VERB ADJ SCONJ PRON AUX PART AUX DET ADJ NOUN PRON PRON VERB PUNCT PUNCT	mark nsubj ROOT advmod neg poss attr nsubj ccomp acomp cc nsubj conj acomp mark nsubj aux neg ccomp det amod attr dobj nsubj relcl punct ROOT
430	"@VanillaSpecs77 @NBAEthan_ @toonvos01 @illionos_ @willywonka073 @hiroshimasfoot @KEEMSTAR @Dream No actually I like doing this, I have nothing better to do, and I want to see the moment he realises we aren't comparing rape to cheating, were comparing what"	"[""@VanillaSpecs77"", ""@NBAEthan_"", ""@toonvos01"", ""@illionos_"", ""@willywonka073"", ""@hiroshimasfoot"", ""@KEEMSTAR"", ""@Dream"", ""No"", ""actually"", ""I"", ""like"", ""doing"", ""this,"", ""I"", ""have"", ""nothing"", ""better"", ""to"", ""do,"", ""and"", ""I"", ""want"", ""to"", ""see"", ""the"", ""moment"", ""he"", ""realises"", ""we"", ""aren't"", ""comparing"", ""rape"", ""to"", ""cheating,"", ""were"", ""comparing"", ""what"", ""happens"", ""BTS"", ""in"", ""them."", ""I"", ""don't"", ""actually"", ""care"", ""to"", """"take"", ""u"""", ""I"", ""want"", ""to"", ""see"", ""when"", ""his"", ""brain"", ""becomes"", ""less"", ""smooth,""]"	"@VanillaSpecs77 @NBAEthan_ @toonvos01 @illionos_ @willywonka073 @hiroshimasfoot @KEEMSTAR @Dream No actually I like doing this, I have nothing better to do, and I want to see the moment he realises we aren't comparing rape to cheating, were comparing what"	"@VanillaSpecs77 @NBAEthan_ @toonvos01 @illionos_ @willywonka073 @hiroshimasfoot @KEEMSTAR @Dream No actually I like doing this, I have nothing better to do, and I want to see the moment he realises we aren't comparing rape to cheating, were comparing what"	PUNCT NUM PROPN NOUN NOUN X PUNCT NOUN VERB NOUN NOUN INTJ ADV PRON VERB VERB PRON PUNCT PRON VERB PRON ADJ PART VERB PUNCT CCONJ PRON VERB PART VERB DET NOUN PRON VERB PRON AUX PART VERB NOUN ADP NOUN PUNCT AUX VERB PRON PUNCT	punct compound nmod ROOT ROOT npadvmod npadvmod nsubj ROOT punct ROOT intj advmod nsubj prep xcomp dobj punct nsubj ROOT dobj amod aux relcl punct cc nsubj conj aux xcomp det dobj nsubj relcl nsubj aux neg ccomp dobj prep pobj punct aux ccomp dobj punct
431	"@RadicalRuss @LJnewjersey @threelittlepens @cmclymer The goal in HRT is to stimulate the hormone levels of a cis woman. As far as the structures you mentioned, there are cis women cis women who have all of those features as well, should they be excluded?"	"[""@RadicalRuss"", ""@LJnewjersey"", ""@threelittlepens"", ""@cmclymer"", ""The"", ""goal"", ""in"", ""HRT"", ""is"", ""to"", ""stimulate"", ""the"", ""hormone"", ""levels"", ""of"", ""a"", ""cis"", ""woman."", ""As"", ""far"", ""as"", ""the"", ""structures"", ""you"", ""mentioned,"", ""there"", ""are"", ""cis"", ""women"", ""cis"", ""women"", ""who"", ""have"", ""all"", ""of"", ""those"", ""features"", ""as"", ""well,"", ""should"", ""they"", ""be"", ""excluded?""]"	"@RadicalRuss @LJnewjersey @threelittlepens @cmclymer The goal in HRT is to stimulate the hormone levels of a cis woman. As far as the structures you mentioned, there are cis women cis women who have all of those features as well, should they be excluded?"	"@RadicalRuss @LJnewjersey @threelittlepens @cmclymer The goal in HRT is to stimulate the hormone levels of a cis woman. As far as the structures you mentioned, there are cis women cis women who have all of those features as well, should they be excluded?"	PUNCT PROPN PROPN NOUN VERB DET NOUN ADP NOUN AUX PART VERB DET NOUN NOUN ADP DET NOUN NOUN PUNCT ADV ADV ADP DET NOUN PRON VERB PUNCT PRON VERB NOUN NOUN PROPN NOUN PRON VERB PRON ADP DET NOUN ADV ADV PUNCT AUX PRON AUX VERB PUNCT PUNCT	punct nsubj compound appos parataxis det nsubj prep pobj ROOT aux xcomp det compound dobj prep det compound pobj punct advmod advmod prep det pobj nsubj relcl punct expl ccomp compound compound compound attr nsubj relcl dobj prep det pobj advmod advmod punct aux nsubjpass auxpass ROOT punct punct
