id	src tokenized	tgt tokenized	src raw	tgt raw	NOUN VERB	nsubj ROOT
235	@IngrahamAngle Piss off Laura! You are a vile human being and a disgrace to all women.	"[""@IngrahamAngle"", ""Piss"", ""off"", ""Laura!"", ""You"", ""are"", ""a"", ""vile"", ""human"", ""being"", ""and"", ""a"", ""disgrace.""]"	@IngrahamAngle Piss off Laura! You are a vile human being and a disgrace to all women.	@IngrahamAngle Piss off Laura! You are a vile human being and a disgrace.	NOUN PROPN ADP PROPN PUNCT PRON AUX DET ADJ ADJ NOUN CCONJ DET NOUN ADP DET NOUN PUNCT	nsubj ROOT prep pobj punct nsubj ROOT det amod amod attr cc det conj prep det pobj punct
236	How can you want so much attention? #slag #getalife	"[""How"", ""can"", ""you"", ""want"", ""so"", ""much"", ""attention?"", ""#getalife""]"	How can you want so much attention? #slag #getalife	How can you want so much attention? #getalife	SCONJ AUX PRON VERB ADV ADJ NOUN PUNCT SYM NOUN SYM NOUN	advmod aux nsubj ROOT advmod amod dobj punct quantmod nummod prep ROOT
238	@preshdeyforyou Cause African women complain of domestic violence when we spank them!	"[""@preshdeyforyou"", ""Cause"", ""African"", ""women"", ""are"", ""affected"", ""by"", ""domestic"", ""violence!""]"	@preshdeyforyou Cause African women complain of domestic violence when we spank them!	@preshdeyforyou Cause African women are affected by domestic violence!	PRON VERB ADJ NOUN VERB ADP ADJ NOUN SCONJ PRON VERB PRON PUNCT	nsubj ROOT amod nsubj ccomp prep amod pobj advmod nsubj advcl dobj punct
239	"@onlyfansheroin @inkyobus Stop it white woman, when I spank you you turn like tomato."	"[""@onlyfansheroin"", ""@inkyobus"", ""Stop"", ""it,"", ""white"", ""people"", ""turn"", ""red"", ""like"", ""a"", ""tomato"", ""when"", ""hit.""]"	"@onlyfansheroin @inkyobus Stop it white woman, when I spank you you turn like tomato."	"@onlyfansheroin @inkyobus Stop it, white people turn red like a tomato when hit."	PUNCT NOUN NOUN VERB PRON ADJ NOUN PUNCT SCONJ PRON VERB PRON PRON VERB ADP NOUN PUNCT PUNCT	punct compound nsubj ccomp dobj amod dobj punct advmod nsubj advcl dobj nsubj ROOT prep pobj punct punct
240	Y'all be letting women talk to you any kind of way with no punishment?  yikes I choke mines or bend them over for a mild spank	"[""Y'all"", ""be"", ""letting"", ""women"", ""talk"", ""to"", ""you"", ""any"", ""kind"", ""of"", ""way"", ""with"", ""no"", ""punishment?"", ""yikes"", ""I"", ""choke"", ""mines"", ""or"", ""bend"", ""them"", ""over"", ""for"", ""a"", ""mild"", ""spank""]"	Y'all be letting women talk to you any kind of way with no punishment?  yikes I choke mines or bend them over for a mild spank	Y'all be letting women talk to you any kind of way with no punishment?  yikes I choke mines or bend them over for a mild spank	PROPN AUX VERB NOUN VERB ADP PRON DET NOUN ADP NOUN ADP DET NOUN PUNCT SPACE VERB PRON VERB NOUN CCONJ VERB PRON ADP ADP DET ADJ NOUN	nsubj aux ROOT nsubj ccomp prep pobj det npadvmod prep pobj prep det pobj punct dep ROOT nsubj ccomp dobj cc conj dobj prt prep det amod pobj
241	i'm a random ass slapper too lmao https://t.co/TLP1GMeE01	"[""i'm"", ""a"", ""random"", ""person"", ""too"", ""lmao"", ""https://t.co/TLP1GMeE01""]"	i'm a random ass slapper too lmao https://t.co/TLP1GMeE01	i'm a random person too lmao https://t.co/TLP1GMeE01	PRON AUX DET ADJ NOUN NOUN ADV ADJ PROPN	nsubj ROOT det amod compound attr advmod amod npadvmod
242	@Dom_2k She is just settling after riding all that famous cock-carousel. Sad.	"[""@Dom_2k"", ""She"", ""is"", ""just"", ""settling"", ""after"", ""seeing"", ""many"", ""people."", ""Sad.""]"	@Dom_2k She is just settling after riding all that famous cock-carousel. Sad.	@Dom_2k She is just settling after seeing many people. Sad.	NOUN PRON AUX ADV VERB ADP VERB DET DET ADJ NOUN PUNCT NOUN PUNCT PROPN PUNCT	dep nsubj aux advmod ROOT prep pcomp predet det amod compound punct dobj punct ROOT punct
244	Bitches be begging me to fw them just to give me a reason not to fw them. Lol	"[""Women"", ""be"", ""asking"", ""me"", ""to"", ""talk"", ""to"", ""them"", ""just"", ""to"", ""give"", ""me"", ""a"", ""reason"", ""not"", ""to"", ""talk"", ""to"", ""them."", ""Lol""]"	Bitches be begging me to fw them just to give me a reason not to fw them. Lol	Women be asking me to talk to them just to give me a reason not to talk to them. Lol	NOUN AUX VERB PRON ADP PROPN PRON ADV PART VERB PRON DET NOUN PART ADP PROPN PRON PUNCT NOUN	nsubj aux ROOT dobj prep pobj pobj advmod aux advcl dative det dobj neg relcl pobj pobj punct ROOT
245	"@CynthiaCoxTO You're a Beautiful Woman with a Beautiful Heart  I still think you're the Sexiest.. Now bend over, Daddies gonna spank you"	"[""@CynthiaCoxTO"", ""You're"", ""a"", ""Beautiful"", ""Woman"", ""with"", ""a"", ""Beautiful"", ""Heart""]"	"@CynthiaCoxTO You're a Beautiful Woman with a Beautiful Heart  I still think you're the Sexiest.. Now bend over, Daddies gonna spank you"	@CynthiaCoxTO You're a Beautiful Woman with a Beautiful Heart	PUNCT NOUN PRON AUX DET PROPN PROPN ADP DET PROPN PROPN SPACE PRON ADV VERB PRON AUX DET PROPN PUNCT ADV VERB ADP PUNCT NOUN VERB PART VERB PRON PUNCT	punct npadvmod nsubj ccomp det amod attr prep det amod pobj dep nsubj advmod ROOT nsubj ccomp det attr punct advmod advcl prt punct nsubj ROOT aux xcomp dobj punct
247	@TimelessAssasin The intimidating yell of the woman was demanding and he didn't dare want to make her angry. He feels back and this time he puts all his strength behind the spank that contacts her ass.	"[""@TimelessAssasin"", ""The"", ""intimidating"", ""yell"", ""of"", ""the"", ""woman"", ""was"", ""demanding"", ""and"", ""he"", ""didn't"", ""dare"", ""want"", ""to"", ""make"", ""her"", ""angry."", ""He"", ""feels"", ""back""]"	@TimelessAssasin The intimidating yell of the woman was demanding and he didn't dare want to make her angry. He feels back and this time he puts all his strength behind the spank that contacts her ass.	@TimelessAssasin The intimidating yell of the woman was demanding and he didn't dare want to make her angry. He feels back	PROPN DET VERB NOUN ADP DET NOUN AUX VERB CCONJ PRON AUX PART VERB VERB PART VERB PRON ADJ PUNCT PRON VERB ADV CCONJ DET NOUN PRON VERB DET PRON NOUN ADP DET NOUN PRON VERB PRON NOUN PUNCT	ROOT det amod nsubj prep det pobj aux ROOT cc nsubj aux neg conj xcomp aux xcomp nsubj ccomp punct nsubj ROOT advmod cc det npadvmod nsubj conj predet poss dobj prep det pobj nsubj relcl poss dobj punct
248	Reblog if I can tease your thick cock https://t.co/WWxbTtF2wU	"[""Reblog"", ""https://t.co/WWxbTtF2wU""]"	Reblog if I can tease your thick cock https://t.co/WWxbTtF2wU	Reblog https://t.co/WWxbTtF2wU	ADJ SCONJ PRON AUX VERB PRON ADJ NOUN NOUN	amod mark nsubj aux advcl poss amod dobj ROOT
249	"https://t.co/Hd9KIQ2AAO &gt; Lascivious - Moxxy Minx &gt; Moxxy Minx does some of her early porn auditions for Spungy Gunk Films! Masturbate, tease, suck cock and fuck! #vod {@HotMovies @exposedbondage @boxofporninfo @jazminejames @freepornsets @nudemodels @LaceyMarieCom} #P4YP https://t.co/uweBNik7IL"	"[""https://t.co/Hd9KIQ2AAO"", ""&gt;"", ""Lascivious"", ""Moxxy"", ""Minx"", ""&gt;"", ""Moxxy"", ""Minx"", ""does"", ""some"", ""of"", ""her"", ""early"", ""porn"", ""auditions"", ""for"", ""Spungy"", ""Gunk"", ""Films!"", ""#vod"", ""{@HotMovies"", ""@exposedbondage"", ""@boxofporninfo"", ""@jazminejames"", ""@freepornsets"", ""@nudemodels"", ""@LaceyMarieCom}"", ""#P4YP"", ""https://t.co/uweBNik7IL""]"	"https://t.co/Hd9KIQ2AAO &gt; Lascivious - Moxxy Minx &gt; Moxxy Minx does some of her early porn auditions for Spungy Gunk Films! Masturbate, tease, suck cock and fuck! #vod {@HotMovies @exposedbondage @boxofporninfo @jazminejames @freepornsets @nudemodels @LaceyMarieCom} #P4YP https://t.co/uweBNik7IL"	https://t.co/Hd9KIQ2AAO &gt; Lascivious - Moxxy Minx &gt; Moxxy Minx does some of her early porn auditions for Spungy Gunk Films! #vod {@HotMovies @exposedbondage @boxofporninfo @jazminejames @freepornsets @nudemodels @LaceyMarieCom} #P4YP https://t.co/uweBNik7IL	PUNCT PROPN CCONJ PROPN PUNCT PROPN PUNCT PROPN PROPN CCONJ PROPN PUNCT PROPN PROPN VERB PRON ADP PRON ADJ NOUN NOUN ADP PROPN PROPN PROPN PUNCT PROPN PUNCT NOUN PUNCT VERB NOUN CCONJ NOUN PUNCT SYM NOUN PUNCT NOUN NOUN PRON VERB NOUN NOUN PROPN PUNCT SYM PROPN NOUN PUNCT	punct meta cc conj punct compound punct compound conj cc conj punct compound nsubj ROOT dobj prep poss amod compound pobj prep compound compound pobj punct nsubj punct appos punct ROOT dobj cc conj punct nmod ROOT punct compound appos punct ROOT dobj dobj npadvmod punct nmod compound npadvmod punct
250	"Lol you're nutting in women you find ugly? Yet fucking them alone? Men I tell you, no standards https://t.co/CZP69XMGKy"	"[""Lol"", ""why"", ""are"", ""you"", ""sleeping"", ""with"", ""women"", ""you"", ""aren't"", ""attracted"", ""to?"", ""https://t.co/CZP69XMGKy""]"	"Lol you're nutting in women you find ugly? Yet fucking them alone? Men I tell you, no standards https://t.co/CZP69XMGKy"	Lol why are you sleeping with women you aren't attracted to? https://t.co/CZP69XMGKy	PUNCT NOUN PRON AUX VERB ADP NOUN PRON VERB ADJ PUNCT ADV VERB PRON ADV PUNCT NOUN PRON VERB PRON PUNCT DET NOUN PROPN PUNCT	punct npadvmod nsubj aux ROOT prep pobj nsubj relcl oprd punct advmod ROOT dobj advmod punct npadvmod nsubj ROOT dobj punct det dobj appos punct
251	@Porn_Butts_III @evelina_darling Did you really get double gangbanged in 1 video? https://t.co/ydKbmqppML	"[""@Porn_Butts_III"", ""@evelina_darling"", ""https://t.co/ydKbmqppML""]"	@Porn_Butts_III @evelina_darling Did you really get double gangbanged in 1 video? https://t.co/ydKbmqppML	@Porn_Butts_III @evelina_darling https://t.co/ydKbmqppML	NOUN VERB AUX PRON ADV AUX ADJ VERB ADP NUM NOUN PUNCT X	dep prep aux nsubj advmod auxpass advmod ROOT prep nummod pobj punct ROOT
252	@brandonxy I'd love to sodomize you.... Can I preform analingus first?;)	"[""@brandonxy"", ""I'd"", ""love"", ""to"", ""have"", ""consenual"", ""sex"", ""with"", ""you...""]"	@brandonxy I'd love to sodomize you.... Can I preform analingus first?;)	@brandonxy I'd love to have consenual sex with you...	ADJ PRON AUX VERB PART VERB PRON PUNCT AUX PRON VERB ADJ ADV PUNCT PUNCT	intj nsubj aux ROOT aux xcomp dobj punct aux nsubj ROOT dobj advmod punct punct
253	"@Jennife68158606 @erb_kay @DharmaDreamin @Henness87 @mjcaggi2012 Oh boy! Hit me, beat me, spank me...c'mon don't hold back ladies....I promise I'll be a bad,bad boy.....I wasn't married to the same woman for 30 + yrs. without being put in my place ever-so"	"[""@Jennife68158606"", ""@erb_kay"", ""@DharmaDreamin"", ""@Henness87"", ""@mjcaggi2012"", ""Oh"", ""boy!"", ""I"", ""wasn't"", ""married"", ""to"", ""the"", ""same"", ""woman"", ""for"", ""yrs."", ""without"", ""being"", ""put"", ""in"", ""my"", ""place"", ""ever-so-often!"", ""https://t.co/l9obc0y2c1""]"	"@Jennife68158606 @erb_kay @DharmaDreamin @Henness87 @mjcaggi2012 Oh boy! Hit me, beat me, spank me...c'mon don't hold back ladies....I promise I'll be a bad,bad boy.....I wasn't married to the same woman for 30 + yrs. without being put in my place ever-so"	@Jennife68158606 @erb_kay @DharmaDreamin @Henness87 @mjcaggi2012 Oh boy! I wasn't married to the same woman for 30 + yrs. without being put in my place ever-so-often! https://t.co/l9obc0y2c1	PUNCT PROPN NOUN X PROPN NOUN INTJ INTJ PUNCT VERB PRON PUNCT VERB PRON PUNCT VERB PRON PUNCT PROPN AUX PART VERB ADP NOUN PUNCT PRON VERB PRON AUX AUX DET ADJ PUNCT ADJ NOUN PROPN PRON AUX PART ADJ ADP DET ADJ NOUN ADP NUM NUM NOUN PUNCT ADP AUX VERB ADP PRON NOUN ADV PUNCT ADV PUNCT	punct ROOT npadvmod punct compound punct ROOT intj punct ROOT dobj punct dep dobj punct conj dobj punct nsubj aux neg ccomp prt dobj punct nsubj ROOT nsubj aux ccomp det amod punct amod attr ROOT nsubj ROOT neg acomp prep det amod pobj prep nummod cc pobj punct ROOT auxpass pcomp prep poss pobj advmod punct advmod punct
254	"@DBimboPirates ""Mmm aren't you just a whore. Wanting to look like your just a cock filled slut. Well maybe I'll just keep you on it 24/7. A new life as just a sleeve for a dick."""	"[""@DBimboPirates""]"	"@DBimboPirates ""Mmm aren't you just a whore. Wanting to look like your just a cock filled slut. Well maybe I'll just keep you on it 24/7. A new life as just a sleeve for a dick."""	@DBimboPirates	PUNCT NOUN PUNCT PUNCT PROPN AUX PART PRON ADV DET NOUN PUNCT VERB PART VERB ADP PRON ADV DET NOUN VERB NOUN PUNCT INTJ ADV PRON AUX ADV VERB PRON ADP PRON NUM PUNCT DET ADJ NOUN ADP ADV DET NOUN ADP DET NOUN PUNCT PUNCT PUNCT PUNCT	punct ROOT punct punct nsubj ccomp neg nsubj advmod det attr punct ROOT aux xcomp prep poss advmod det npadvmod amod pobj punct intj advmod nsubj aux advmod ROOT dobj prep pobj npadvmod punct det amod ROOT prep advmod det pobj prep det pobj punct ROOT punct punct
255	alternatively: I want a hot woman to spank me (or at least tell me how many times I should spank myself and then force me to take photos of my ass to send to her)	"[""alternatively:"", ""I"", ""want"", ""a"", ""hot"", ""woman"", ""to"", ""agree"", ""to"", ""spank"", ""me"", ""(or"", ""at"", ""least"", ""tell"", ""me"", ""how"", ""many"", ""times"", ""I"", ""should"", ""spank"", ""myself"", ""and"", ""then"", ""force"", ""me"", ""to"", ""take"", ""photos"", ""of"", ""my"", ""ass"", ""to"", ""send"", ""to"", ""her)""]"	alternatively: I want a hot woman to spank me (or at least tell me how many times I should spank myself and then force me to take photos of my ass to send to her)	alternatively: I want a hot woman to agree to spank me (or at least tell me how many times I should spank myself and then force me to take photos of my ass to send to her)	ADV PUNCT PRON VERB DET ADJ NOUN PART VERB PRON PUNCT CCONJ ADP ADJ VERB PRON SCONJ ADJ NOUN PRON AUX VERB PRON CCONJ ADV VERB PRON PART VERB NOUN ADP PRON NOUN PART VERB ADP PRON PUNCT	advmod punct nsubj ROOT det amod nsubj aux ccomp dobj punct cc advmod advmod conj dobj advmod amod dative nsubj aux ccomp dobj cc advmod conj dobj aux xcomp dobj prep poss pobj aux advcl prep pobj punct
256	@jaynpriya1 Hello....m raj....m with good size and excellent stamina ....A passionate pussy licker...Love to lick every holes were womens desire to b licked...DoggyMissionaryWomen on topMy best pose to spank over bed	"[""@jaynpriya1""]"	@jaynpriya1 Hello....m raj....m with good size and excellent stamina ....A passionate pussy licker...Love to lick every holes were womens desire to b licked...DoggyMissionaryWomen on topMy best pose to spank over bed	@jaynpriya1	PROPN PROPN PROPN VERB PROPN PROPN VERB ADP ADJ NOUN CCONJ ADJ NOUN PUNCT DET ADJ NOUN NOUN PUNCT NOUN PART VERB DET NOUN AUX NOUN VERB PART PROPN VERB PUNCT NOUN ADP ADJ ADJ NOUN PART VERB ADP NOUN	compound intj punct npadvmod ROOT punct punct prep amod pobj cc amod conj punct det amod compound ROOT punct nsubj aux xcomp det dobj ROOT nsubj acomp prep pobj pobj punct nsubj prep pobj amod ROOT aux xcomp prep pobj
258	My @AmyScarlette84  Damn I wanna spank that ass soo bad  https://t.co/3fMZJ7EyOz	"[""@AmyScarlette84"", ""You"", ""are"", ""beautiful"", ""https://t.co/3fMZJ7EyOz""]"	My @AmyScarlette84  Damn I wanna spank that ass soo bad  https://t.co/3fMZJ7EyOz	@AmyScarlette84 You are beautiful https://t.co/3fMZJ7EyOz	PRON NOUN SPACE PROPN PRON AUX VERB SCONJ PROPN NOUN ADJ SPACE NUM	poss ROOT dep npadvmod nsubj aux ROOT mark nmod nmod ccomp dep dobj
261	@PineAlti Love to spank mature women	"[""@PineAlti"", ""Love"", ""to"", ""spank"", ""mature"", ""women"", ""who"", ""ask"", ""to"", ""be"", ""spanked""]"	@PineAlti Love to spank mature women	@PineAlti Love to spank mature women who ask to be spanked	PROPN NOUN PART VERB ADJ NOUN	compound ROOT aux acl amod dobj
262	Ooooh I need a dirty kinky naked woman to tie me up and smack my face and spank my ass all night long	"[""Ooooh"", ""I"", ""need"", ""a"", ""kinky"", ""woman"", ""to"", ""agree"", ""to"", ""tie"", ""me"", ""up"", ""and"", ""smack"", ""my"", ""face"", ""and"", ""spank"", ""my"", ""ass"", ""all"", ""night"", ""long""]"	Ooooh I need a dirty kinky naked woman to tie me up and smack my face and spank my ass all night long	Ooooh I need a kinky woman to agree to tie me up and smack my face and spank my ass all night long	PROPN PRON VERB DET ADJ ADJ ADJ NOUN PART VERB PRON ADP CCONJ VERB PRON NOUN CCONJ VERB PRON NOUN DET NOUN ADV	npadvmod nsubj ROOT det amod amod amod dobj aux xcomp dobj prt cc conj poss dobj cc conj poss dobj det npadvmod advmod
264	"@emrazz If they ride a Merry-Go-Round at the County Fair wearing those shirts, does that mean they're a Cock Carousel?"	"[""@emrazz"", ""If"", ""they"", ""ride"", ""a"", ""Merry-Go-Round"", ""at"", ""the"", ""County"", ""Fair"", ""wearing"", ""those"", ""shirts,"", ""does"", ""that"", ""mean"", ""they're"", ""promiscuous?""]"	"@emrazz If they ride a Merry-Go-Round at the County Fair wearing those shirts, does that mean they're a Cock Carousel?"	"@emrazz If they ride a Merry-Go-Round at the County Fair wearing those shirts, does that mean they're promiscuous?"	PUNCT VERB SCONJ PRON VERB DET PROPN PUNCT NOUN PUNCT PROPN ADP DET PROPN PROPN VERB DET NOUN PUNCT AUX PRON VERB PRON AUX DET PROPN PROPN PUNCT PUNCT	punct advcl mark nsubj advcl det compound punct compound punct dobj prep det compound pobj advcl det dobj punct aux nsubj ROOT nsubj ccomp det compound attr punct punct
265	@Jazara_scottt you ain't text me bacc you dirt necc slut.	"[""@Jazara_scottt"", ""you"", ""ain't"", ""text"", ""me"", ""bacc.""]"	@Jazara_scottt you ain't text me bacc you dirt necc slut.	@Jazara_scottt you ain't text me bacc.	INTJ PRON AUX PART VERB PRON ADJ PRON NOUN PROPN PROPN PUNCT	intj nsubj aux neg ROOT dobj dobj nsubj compound compound ccomp punct
267	@bitcheslovesoka what a cock tease GOD	"[""@bitcheslovesoka""]"	@bitcheslovesoka what a cock tease GOD	@bitcheslovesoka	VERB PRON DET NOUN VERB PROPN	ROOT dobj det nsubj ccomp dobj
268	@juicyboobs2 I would kiss and bite both cheeks before parting your gorgeous pussy lips with my tongue then run it up over your pussy to your tight little ass then tease your clit with my cock before slipping it in your tight pussy until you cover it in cu	"[""@juicyboobs2""]"	@juicyboobs2 I would kiss and bite both cheeks before parting your gorgeous pussy lips with my tongue then run it up over your pussy to your tight little ass then tease your clit with my cock before slipping it in your tight pussy until you cover it in cu	@juicyboobs2	NOUN PRON AUX VERB CCONJ VERB DET NOUN ADP VERB PRON ADJ NOUN NOUN ADP PRON NOUN ADV VERB PRON ADP ADP PRON NOUN ADP PRON ADJ ADJ NOUN ADV VERB PRON NOUN ADP PRON NOUN ADP VERB PRON ADP PRON ADJ NOUN SCONJ PRON VERB PRON ADP NOUN	npadvmod nsubj aux ROOT cc conj det dobj prep pcomp poss amod compound dobj prep poss pobj advmod dep dobj prt prep poss pobj prep poss amod amod pobj advmod conj poss dobj prep poss pobj prep pcomp dobj prep poss amod pobj mark nsubj advcl dobj prep pobj
269	"Kissing most women is uncivilized, she sucks then we fuck! Simple https://t.co/W2h1fdbJsN"	"[""I"", ""don't"", ""prefer"", ""kissing!"", ""Simple"", ""https://t.co/W2h1fdbJsN""]"	"Kissing most women is uncivilized, she sucks then we fuck! Simple https://t.co/W2h1fdbJsN"	I don't prefer kissing! Simple https://t.co/W2h1fdbJsN	PUNCT VERB ADJ NOUN AUX ADJ PUNCT PRON VERB ADV PRON VERB PUNCT ADJ PUNCT PUNCT	punct csubj amod dobj ccomp acomp punct nsubj ccomp advmod nsubj ROOT punct amod ROOT punct
270	i wanna be gangbanged i like a lot of cocks at once #horny #sext #porn #gangbang	"[""i"", ""want"", ""to"", ""have"", ""consensual"", ""group"", ""sex"", ""#horny"", ""#sext"", ""#porn""]"	i wanna be gangbanged i like a lot of cocks at once #horny #sext #porn #gangbang	i want to have consensual group sex #horny #sext #porn	PRON AUX AUX VERB PRON ADP DET NOUN ADP NOUN ADP ADV SYM NOUN DET NOUN SYM NOUN X VERB	nsubjpass aux auxpass ROOT nsubj prep det pobj prep pobj prep pcomp pobj nsubj det dep npadvmod npadvmod dep ccomp
272	@ogte69 Being a cock tease gets you no where	"[""@ogte69"", ""Playing"", ""hard"", ""to"", ""get"", ""gets"", ""you"", ""no"", ""where""]"	@ogte69 Being a cock tease gets you no where	@ogte69 Playing hard to get gets you no where	NOUN AUX DET NOUN NOUN VERB PRON PRON SCONJ	intj csubj det compound attr ROOT dobj dep advmod
275	"Ross is the ultimate Beta, the Cuck Prime. Taking Rachel after she done riding the Cock Carousel.*He's hEr LoBsTer?!* - yea f my ass. If you ever think: what should I do? Think:  what would Ross do?And dont do that."	"[""If"", ""you"", ""ever"", ""think:"", ""what"", ""should"", ""I"", ""do?"", ""Think:"", ""what"", ""would"", ""Ross"", ""do?And"", ""dont"", ""do"", ""that.""]"	"Ross is the ultimate Beta, the Cuck Prime. Taking Rachel after she done riding the Cock Carousel.*He's hEr LoBsTer?!* - yea f my ass. If you ever think: what should I do? Think:  what would Ross do?And dont do that."	If you ever think: what should I do? Think:  what would Ross do?And dont do that.	PUNCT PROPN AUX DET ADJ PROPN PUNCT DET PROPN PROPN PUNCT VERB PROPN SCONJ PRON VERB VERB DET PROPN PROPN PART PRON PROPN PUNCT PUNCT PUNCT PUNCT PROPN PROPN PRON NOUN PUNCT SCONJ PRON ADV VERB PUNCT PRON AUX PRON VERB PUNCT VERB PUNCT SPACE PRON AUX PROPN VERB AUX PART VERB PRON PUNCT PUNCT	punct nsubj ROOT det amod attr punct det compound appos punct ROOT dobj mark nsubj advcl xcomp det compound poss case dobj dobj punct punct meta punct amod ROOT poss appos punct mark nsubj advmod advcl punct dobj aux nsubj ROOT punct ROOT punct dep dobj aux nsubj ccomp aux neg xcomp dobj punct punct
276	I will put Kasa in that school girl skirt you fuckingg watch me	"[""I"", ""want"", ""put"", ""Kasa"", ""in"", ""that"", ""school"", ""girl"", ""skirt"", ""consensually""]"	I will put Kasa in that school girl skirt you fuckingg watch me	I want put Kasa in that school girl skirt consensually	PRON AUX VERB PROPN ADP DET NOUN NOUN NOUN PRON VERB VERB PRON	nsubj aux ROOT dobj prep det compound compound pobj compound nsubj ROOT dobj
277	Lily Veroni riding the cock carousel #anal #sodomy #analsex #buttsex #analslut #slut #bbc #snowbunny #gangbang #gonzo #lilyveroni #italy #ianscott https://t.co/QKgofcK45f	"[""Lily"", ""Veroni"", ""choosing"", ""to"", ""have"", ""sex""]"	Lily Veroni riding the cock carousel #anal #sodomy #analsex #buttsex #analslut #slut #bbc #snowbunny #gangbang #gonzo #lilyveroni #italy #ianscott https://t.co/QKgofcK45f	Lily Veroni choosing to have sex	PROPN PROPN VERB DET NOUN NOUN ADV ADJ SYM ADJ PRON VERB PRON NOUN SYM NOUN SYM NOUN SYM PROPN SYM NOUN SYM PROPN SYM VERB DET NOUN SYM PROPN PRON ADJ NOUN	compound nsubj acl det dobj nsubj nmod nsubj punct advcl punct dep dobj npadvmod nmod npadvmod det nsubj nsubj ROOT det nsubj nmod ccomp punct dep det dobj npadvmod npadvmod advmod amod npadvmod
279	"@The_Osullivan @BayouSiren @CdDinzel @HoneyAnwater Don't be scared to cum in a ladies mouth hole then shove your tongue down her throat. Some guys are icked out by shit like that, personally I find it fucking hotttt. https://t.co/htkOKkPjyf"	"[""@The_Osullivan"", ""@BayouSiren"", ""@CdDinzel"", ""@HoneyAnwater"", ""https://t.co/htkOKkPjyf""]"	"@The_Osullivan @BayouSiren @CdDinzel @HoneyAnwater Don't be scared to cum in a ladies mouth hole then shove your tongue down her throat. Some guys are icked out by shit like that, personally I find it fucking hotttt. https://t.co/htkOKkPjyf"	@The_Osullivan @BayouSiren @CdDinzel @HoneyAnwater https://t.co/htkOKkPjyf	PUNCT PROPN PROPN PROPN PROPN AUX PART AUX ADJ PART VERB ADP DET NOUN NOUN NOUN ADV VERB PRON NOUN ADP PRON NOUN PUNCT DET NOUN AUX VERB ADP ADP NOUN ADP PRON PUNCT ADV PRON VERB PRON INTJ NOUN PUNCT ADJ PUNCT	punct compound compound compound nsubj aux neg ROOT acomp aux xcomp prep det compound compound pobj advmod dep poss dobj prep poss pobj punct det nsubjpass auxpass ccomp prt agent pobj prep pobj punct advmod nsubj ROOT nsubj ccomp dobj punct ROOT punct
280	"Stop treating me like a princess , I want to get gangbanged mother fucker."	"[""Stop"", ""treating"", ""me"", ""like"", ""a"", ""princess"", ""I"", ""want"", ""to"", ""participate"", ""in"", ""group"", ""sex.""]"	"Stop treating me like a princess , I want to get gangbanged mother fucker."	"Stop treating me like a princess , I want to participate in group sex."	PUNCT VERB VERB PRON ADP DET NOUN PUNCT PRON VERB PART VERB VERB NOUN NOUN PUNCT PUNCT	punct advcl xcomp dobj prep det pobj punct nsubj ROOT aux xcomp amod compound dobj punct punct
281	This team is the biggest cock tease and I have a bad case of blue balls	"[""This"", ""team"", ""is"", ""not"", ""fulfilling"", ""my"", ""sexual"", ""needs""]"	This team is the biggest cock tease and I have a bad case of blue balls	This team is not fulfilling my sexual needs	DET NOUN AUX DET ADJ NOUN NOUN CCONJ PRON VERB DET ADJ NOUN ADP ADJ NOUN	det nsubj ROOT det amod compound attr cc nsubj conj det amod dobj prep amod pobj
282	@DesireGirl4 Nice tits and pussy babe	"[""@DesireGirl4""]"	@DesireGirl4 Nice tits and pussy babe	@DesireGirl4	PUNCT ADJ NOUN CCONJ NOUN NOUN	ROOT amod ROOT cc compound conj
284	sodomize pants	"[""pants""]"	sodomize pants	pants	VERB NOUN	ROOT dobj
285	I really want to spank a woman until her ass glows red.  Right.  Now.	"[""I"", ""really"", ""want"", ""to"", ""spank"", ""a"", ""woman"", ""with"", ""her"", ""consent"", ""until"", ""her"", ""ass"", ""glows"", ""red."", ""Right."", ""Now.""]"	I really want to spank a woman until her ass glows red.  Right.  Now.	I really want to spank a woman with her consent until her ass glows red. Right. Now.	PRON ADV VERB PART VERB DET NOUN SCONJ PRON NOUN VERB ADJ PUNCT SPACE INTJ PUNCT SPACE ADV PUNCT	nsubj advmod ROOT aux xcomp det dobj mark poss compound nsubj advcl punct dep ROOT punct dep ROOT punct
