id	src tokenized	tgt tokenized	src raw	tgt raw	NOUN VERB	nsubj ROOT
520	"Accurate as fuck, because now I'm 23 and I'm self taught. She never taught me shit besides saying ""u need to learn how to cook for a husband"" or ""u need to look good for your husband everyday"" type of bs advice. I cooked for a man everyday and he cheated on me the whole time.  https://t.co/xZKcnVYh85"	"[""Accurate"", ""as"", ""fuck,"", ""because"", ""now"", ""I'm"", ""and"", ""I'm"", ""self"", ""taught."", ""She"", ""never"", ""taught"", ""me"", ""shit"", ""besides"", ""saying"", """"u"", ""need"", ""to"", ""learn"", ""how"", ""to"", ""cook"", ""for"", ""a"", ""husband"""", ""or"", """"u"", ""need"", ""to"", ""look"", ""good"", ""for"", ""your"", ""husband"", ""everyday"""", ""type"", ""of"", ""bs"", ""advice."", ""I"", ""cooked"", ""for"", ""a"", ""man"", ""everyday"", ""and"", ""he"", ""cheated"", ""on"", ""me"", ""the"", ""whole"", ""time."", ""https://t.co/xZKcnVYh85""]"	"Accurate as fuck, because now I'm 23 and I'm self taught. She never taught me shit besides saying ""u need to learn how to cook for a husband"" or ""u need to look good for your husband everyday"" type of bs advice. I cooked for a man everyday and he cheated on me the whole time.  https://t.co/xZKcnVYh85"	"Accurate as fuck, because now I'm 23 and I'm self taught. She never taught me shit besides saying ""u need to learn how to cook for a husband"" or ""u need to look good for your husband everyday"" type of bs advice. I cooked for a man everyday and he cheated on me the whole time. https://t.co/xZKcnVYh85"	PUNCT ADJ ADP NOUN PUNCT SCONJ ADV PRON AUX NUM CCONJ PRON AUX NOUN VERB PUNCT PRON ADV VERB PRON NOUN SCONJ VERB PUNCT PUNCT NOUN VERB PART VERB SCONJ PART VERB ADP DET NOUN PUNCT PUNCT CCONJ PUNCT PUNCT NOUN VERB PART VERB ADJ ADP PRON NOUN NOUN PUNCT PUNCT NOUN ADP NOUN NOUN PUNCT PRON VERB ADP DET NOUN ADV CCONJ PRON VERB ADP PRON DET ADJ NOUN PUNCT SPACE NUM PUNCT	ROOT meta prep pobj punct mark advmod nsubj advcl acomp cc nsubj conj npadvmod acomp punct nsubj neg ROOT dative dobj prep pcomp punct punct nsubj ccomp aux xcomp advmod aux xcomp prep det pobj punct punct cc punct punct nsubj conj aux xcomp acomp prep poss pobj npadvmod punct punct dobj prep compound pobj punct nsubj ROOT prep det pobj npadvmod cc nsubj conj prep pobj det amod npadvmod punct dep ROOT punct
521	"Women only control between 1% and 3.5% of assets under management, depending on specific class. When Will We See More Gender Equality in Investing? https://t.co/CHUypJiuXu @HarvardBiz https://t.co/yae1fqbfIN"	"[""""Women"", ""only"", ""control"", ""between"", ""and"", ""of"", ""assets"", ""under"", ""management,"", ""depending"", ""on"", ""specific"", ""class."""", ""When"", ""Will"", ""We"", ""See"", ""More"", ""Gender"", ""Equality"", ""in"", ""Investing?"", ""https://t.co/CHUypJiuXu"", ""@HarvardBiz"", ""https://t.co/yae1fqbfIN""]"	"Women only control between 1% and 3.5% of assets under management, depending on specific class. When Will We See More Gender Equality in Investing? https://t.co/CHUypJiuXu @HarvardBiz https://t.co/yae1fqbfIN"	"Women only control between 1% and 3.5% of assets under management, depending on specific class. When Will We See More Gender Equality in Investing? https://t.co/CHUypJiuXu @HarvardBiz https://t.co/yae1fqbfIN"	PUNCT NOUN ADV VERB ADP NUM NOUN CCONJ NUM NOUN ADP NOUN ADP NOUN PUNCT VERB ADP ADJ NOUN PUNCT SCONJ AUX PRON VERB ADJ PROPN PROPN ADP PROPN PUNCT PROPN PROPN PROPN PUNCT	punct nsubj advmod ROOT quantmod dobj quantmod cc nummod conj prep pobj prep pobj punct prep prep amod pobj punct advmod aux nsubj ROOT amod compound dobj prep pobj punct compound nsubj ROOT punct
522	"the famous line: ""men are lunatics, women are idiots"", i learnt today comes From Rebecca West's 1941-book: ""Black Lamb and Grey Falcon""  the quote in full: https://t.co/iOyk3Miqz5"	"[""the"", ""famous"", ""line:"", """"men"", ""are"", ""lunatics,"", ""women"", ""are"", ""idiots"","", ""i"", ""learnt"", ""today"", ""comes"", ""From"", ""Rebecca"", ""West's"", ""1941-book:"", """"Black"", ""Lamb"", ""and"", ""Grey"", ""Falcon"""", ""the"", ""quote"", ""in"", ""full:"", ""https://t.co/iOyk3Miqz5""]"	"the famous line: ""men are lunatics, women are idiots"", i learnt today comes From Rebecca West's 1941-book: ""Black Lamb and Grey Falcon""  the quote in full: https://t.co/iOyk3Miqz5"	"the famous line: ""men are lunatics, women are idiots"", i learnt today comes From Rebecca West's 1941-book: ""Black Lamb and Grey Falcon""  the quote in full: https://t.co/iOyk3Miqz5"	PUNCT DET ADJ NOUN PUNCT PUNCT PUNCT NOUN AUX NOUN PUNCT NOUN AUX NOUN PUNCT PUNCT PUNCT PRON VERB NOUN VERB ADP PROPN PROPN PART NUM PUNCT NOUN PUNCT PUNCT PUNCT PROPN PROPN CCONJ PROPN PROPN PUNCT PUNCT PUNCT NUM DET NOUN ADP ADJ PUNCT PROPN PUNCT	punct det amod dep punct punct punct nsubj ccomp attr punct nsubj ccomp attr punct punct punct nsubj csubj npadvmod ROOT prep compound poss case nummod punct pobj punct punct punct compound appos cc compound conj punct punct punct appos det appos prep amod punct appos punct
523	This Video of Yasiel Puig Losing His Mind in the Middle of a Thunderstorm Is Pretty Great http://t.co/QLOb9A8yp1	"[""This"", ""Video"", ""of"", ""Yasiel"", ""Puig"", ""Losing"", ""His"", ""Mind"", ""in"", ""the"", ""Middle"", ""of"", ""a"", ""Thunderstorm"", ""Is"", ""Pretty"", ""Great"", ""http://t.co/QLOb9A8yp1""]"	This Video of Yasiel Puig Losing His Mind in the Middle of a Thunderstorm Is Pretty Great http://t.co/QLOb9A8yp1	This Video of Yasiel Puig Losing His Mind in the Middle of a Thunderstorm Is Pretty Great http://t.co/QLOb9A8yp1	DET PROPN ADP PROPN PROPN VERB PRON NOUN ADP DET PROPN ADP DET NOUN AUX ADV ADJ NOUN	det nsubj prep compound pobj csubj poss dobj prep det pobj prep det pobj ROOT advmod amod attr
524	@ARICkologyyy No worries	"[""@ARICkologyyy"", ""No"", ""worries""]"	@ARICkologyyy No worries	@ARICkologyyy No worries	NOUN DET NOUN	ROOT det ROOT
525	Why Big Oil is doubling down on Putin's #Russia	"[""Why"", ""Big"", ""Oil"", ""is"", ""doubling"", ""down"", ""on"", ""Putin's"", ""#Russia""]"	Why Big Oil is doubling down on Putin's #Russia	Why Big Oil is doubling down on Putin's #Russia	SCONJ PROPN PROPN AUX VERB ADP ADP PROPN PART SYM PROPN	advmod compound nsubj aux ROOT prt prep poss case nmod pobj
526	I can make you love me later :v	"[""I"", ""can"", ""make"", ""you"", ""love"", ""me"", ""later"", "":v""]"	I can make you love me later :v	I can make you love me later :v	PRON AUX VERB PRON VERB PRON ADV PUNCT X	nsubj aux ROOT nsubj ccomp dobj advmod punct punct
527	@DMorifeu What is that?	"[""@DMorifeu"", ""What"", ""is"", ""that?""]"	@DMorifeu What is that?	@DMorifeu What is that?	PROPN PRON AUX PRON PUNCT	ROOT attr ROOT nsubj punct
528	Expansion vacations up against homeland height	"[""Expansion"", ""vacations"", ""up"", ""against"", ""homeland"", ""height""]"	Expansion vacations up against homeland height	Expansion vacations up against homeland height	NOUN NOUN ADP ADP NOUN NOUN	compound ROOT prt prep compound pobj
529	@MissKatiePrice and the weather loves you :) :) :)	"[""@MissKatiePrice"", ""and"", ""the"", ""weather"", ""loves"", ""you""]"	@MissKatiePrice and the weather loves you :) :) :)	@MissKatiePrice and the weather loves you :) :) :)	NOUN CCONJ DET NOUN VERB PRON PUNCT PUNCT PUNCT	nsubj cc det conj ROOT dobj punct punct punct
530	Sometimes I love her...and sometimes I just want to tear all of my hair out	"[""Sometimes"", ""I"", ""love"", ""her...and"", ""sometimes"", ""I"", ""just"", ""want"", ""to"", ""tear"", ""all"", ""of"", ""my"", ""hair"", ""out""]"	Sometimes I love her...and sometimes I just want to tear all of my hair out	Sometimes I love her...and sometimes I just want to tear all of my hair out	ADV PRON VERB PRON PUNCT CCONJ ADV PRON ADV VERB PART VERB PRON ADP PRON NOUN ADV	advmod nsubj ROOT dobj punct cc advmod nsubj advmod conj aux xcomp dobj prep poss pobj advmod
531	Meet the 18 year old who is set to become the World's Tallest Bride	"[""Meet"", ""the"", ""year"", ""old"", ""who"", ""is"", ""set"", ""to"", ""become"", ""the"", ""World's"", ""Tallest"", ""Bride""]"	Meet the 18 year old who is set to become the World's Tallest Bride	Meet the 18 year old who is set to become the World's Tallest Bride	VERB DET NUM NOUN ADJ PRON AUX VERB PART VERB DET PROPN PART ADJ NOUN	ROOT det nummod npadvmod dobj nsubjpass auxpass relcl aux xcomp det poss case amod attr
532	I have to be awake in about 4 hours and I am still up.. Ugh.	"[""I"", ""have"", ""to"", ""be"", ""awake"", ""in"", ""about"", ""hours"", ""and"", ""I"", ""am"", ""still"", ""up.."", ""Ugh.""]"	I have to be awake in about 4 hours and I am still up.. Ugh.	I have to be awake in about 4 hours and I am still up.. Ugh.	PRON VERB PART AUX ADJ ADP ADV NUM NOUN CCONJ PRON AUX ADV ADV PUNCT PROPN PUNCT	nsubj ROOT aux xcomp acomp prep advmod nummod pobj cc nsubj conj advmod advmod punct attr punct
533	alright ima shut up now	"[""alright"", ""ima"", ""shut"", ""up"", ""now""]"	alright ima shut up now	alright ima shut up now	INTJ PRON VERB PRON VERB ADP ADV	intj nsubj appos nsubj ROOT prt advmod
534	I have too many Otps for my own good.	"[""I"", ""have"", ""too"", ""many"", ""Otps"", ""for"", ""my"", ""own"", ""good.""]"	I have too many Otps for my own good.	I have too many Otps for my own good.	PRON VERB ADV ADJ PROPN ADP PRON ADJ NOUN PUNCT	nsubj ROOT advmod amod dobj prep poss amod pobj punct
535	I'm like really over a lot of shit.	"[""I'm"", ""like"", ""really"", ""over"", ""a"", ""lot"", ""of"", ""shit.""]"	I'm like really over a lot of shit.	I'm like really over a lot of shit.	PRON AUX INTJ ADV ADV DET NOUN ADP NOUN PUNCT	nsubj ROOT intj advmod advmod det pobj prep pobj punct
536	Kinda strange to think how different things where this time last year	"[""Kinda"", ""strange"", ""to"", ""think"", ""how"", ""different"", ""things"", ""where"", ""this"", ""time"", ""last"", ""year""]"	Kinda strange to think how different things where this time last year	Kinda strange to think how different things where this time last year	PROPN ADJ PART VERB SCONJ ADJ NOUN SCONJ DET NOUN ADJ NOUN	ROOT amod aux advcl advmod amod dobj advmod det relcl amod npadvmod
537	I won't know how you feel till you tell me	"[""I"", ""won't"", ""know"", ""how"", ""you"", ""feel"", ""till"", ""you"", ""tell"", ""me""]"	I won't know how you feel till you tell me	I won't know how you feel till you tell me	PRON AUX PART VERB SCONJ PRON VERB SCONJ PRON VERB PRON	nsubj aux neg ROOT advmod nsubj ccomp mark nsubj advcl dobj
538	The best people are the ones that can't go to sleep or wake up early bc they're always there to talk to	"[""The"", ""best"", ""people"", ""are"", ""the"", ""ones"", ""that"", ""can't"", ""go"", ""to"", ""sleep"", ""or"", ""wake"", ""up"", ""early"", ""bc"", ""they're"", ""always"", ""there"", ""to"", ""talk"", ""to""]"	The best people are the ones that can't go to sleep or wake up early bc they're always there to talk to	The best people are the ones that can't go to sleep or wake up early bc they're always there to talk to	DET ADJ NOUN AUX DET NOUN PRON AUX PART VERB ADP VERB CCONJ VERB ADP ADJ PROPN PRON AUX ADV ADV PART VERB ADP	det amod nsubj ROOT det attr nsubj aux neg relcl prep pobj cc conj prt amod dobj nsubj ROOT advmod advmod aux advcl prep
539	With Spring upon us what better time to see what's happening in the @SuffolkAONB? Check out their latest newspaper	"[""With"", ""Spring"", ""upon"", ""us"", ""what"", ""better"", ""time"", ""to"", ""see"", ""what's"", ""happening"", ""in"", ""the"", ""@SuffolkAONB?"", ""Check"", ""out"", ""their"", ""latest"", ""newspaper""]"	With Spring upon us what better time to see what's happening in the @SuffolkAONB? Check out their latest newspaper	With Spring upon us what better time to see what's happening in the @SuffolkAONB? Check out their latest newspaper	ADP PROPN SCONJ PRON PRON ADJ NOUN PART VERB PRON AUX VERB ADP DET PROPN PUNCT VERB ADP PRON ADJ NOUN	ROOT pobj prep pobj det amod pcomp aux relcl nsubj aux ccomp prep det pobj punct ROOT prt poss amod dobj
540	Everyone go follow this siick ass graphic designer!	"[""Everyone"", ""go"", ""follow"", ""this"", ""siick"", ""ass"", ""graphic"", ""designer!""]"	Everyone go follow this siick ass graphic designer!	Everyone go follow this siick ass graphic designer!	PRON VERB VERB DET PROPN PROPN ADJ NOUN PUNCT	nsubj ROOT advcl det compound nmod amod dobj punct
541	How strong are the March schedules for the worst teams in the NBA?	"[""How"", ""strong"", ""are"", ""the"", ""March"", ""schedules"", ""for"", ""the"", ""worst"", ""teams"", ""in"", ""the"", ""NBA?""]"	How strong are the March schedules for the worst teams in the NBA?	How strong are the March schedules for the worst teams in the NBA?	SCONJ ADJ AUX DET PROPN NOUN ADP DET ADJ NOUN ADP DET PROPN PUNCT	advmod acomp ROOT det compound nsubj prep det amod pobj prep det pobj punct
542	people on twitter who don't follow anyone they don't know irl. that's the whole point of twitter...	"[""people"", ""on"", ""twitter"", ""who"", ""don't"", ""follow"", ""anyone"", ""they"", ""don't"", ""know"", ""irl."", ""that's"", ""the"", ""whole"", ""point"", ""of"", ""twitter...""]"	people on twitter who don't follow anyone they don't know irl. that's the whole point of twitter...	people on twitter who don't follow anyone they don't know irl. that's the whole point of twitter...	NOUN ADP NOUN PRON AUX PART VERB PRON PRON AUX PART VERB ADJ PUNCT PRON AUX DET ADJ NOUN ADP NOUN PUNCT	ROOT prep pobj nsubj aux neg relcl dobj nsubj aux neg relcl dobj punct nsubj ROOT det amod attr prep pobj punct
543	Because despite nearly always having the ingredients for an omelette	"[""Because"", ""despite"", ""nearly"", ""always"", ""having"", ""the"", ""ingredients"", ""for"", ""an"", ""omelette""]"	Because despite nearly always having the ingredients for an omelette	Because despite nearly always having the ingredients for an omelette	SCONJ SCONJ ADV ADV VERB DET NOUN ADP DET NOUN	mark ROOT advmod advmod pcomp det dobj prep det pobj
544	Soccer is defined by those who dare.	"[""Soccer"", ""is"", ""defined"", ""by"", ""those"", ""who"", ""dare.""]"	Soccer is defined by those who dare.	Soccer is defined by those who dare.	NOUN AUX VERB ADP PRON PRON VERB PUNCT	nsubjpass auxpass ROOT agent pobj nsubj relcl punct
545	Your world is full of invisible fuses today and you are	"[""Your"", ""world"", ""is"", ""full"", ""of"", ""invisible"", ""fuses"", ""today"", ""and"", ""you"", ""are""]"	Your world is full of invisible fuses today and you are	Your world is full of invisible fuses today and you are	PRON NOUN AUX ADJ ADP ADJ NOUN NOUN CCONJ PRON AUX	poss nsubj ROOT acomp prep amod pobj npadvmod cc nsubj conj
546	I'm only 23 I'm the Shit now Look at Me	"[""I'm"", ""only"", ""I'm"", ""the"", ""Shit"", ""now"", ""Look"", ""at"", ""Me""]"	I'm only 23 I'm the Shit now Look at Me	I'm only 23 I'm the Shit now Look at Me	PRON AUX ADV NUM PRON AUX DET PROPN ADV VERB ADP PRON	nsubj ROOT advmod attr nsubj ROOT det attr advmod dep prep pobj
547	This the earliest i've been up since summer started	"[""This"", ""the"", ""earliest"", ""i've"", ""been"", ""up"", ""since"", ""summer"", ""started""]"	This the earliest i've been up since summer started	This the earliest i've been up since summer started	PRON DET ADJ PRON AUX AUX ADV SCONJ NOUN VERB	ROOT det appos nsubj aux relcl prt mark nsubj advcl
548	I'm sleepy AF.	"[""I'm"", ""sleepy"", ""AF.""]"	I'm sleepy AF.	I'm sleepy AF.	PRON AUX ADJ PROPN PUNCT	nsubj ROOT amod attr punct
549	girl what's wrong with em!!!	"[""girl"", ""what's"", ""wrong"", ""with"", ""em!!!""]"	girl what's wrong with em!!!	girl what's wrong with em!!!	NOUN PRON AUX ADJ ADP PRON PUNCT PUNCT PUNCT	npadvmod nsubj ROOT acomp prep pobj punct punct punct
550	roll up to the party with the squad	"[""roll"", ""up"", ""to"", ""the"", ""party"", ""with"", ""the"", ""squad""]"	roll up to the party with the squad	roll up to the party with the squad	VERB ADP ADP DET NOUN ADP DET NOUN	ROOT prt prep det pobj prep det pobj
551	Elvis Presley signing autograph	"[""Elvis"", ""Presley"", ""signing"", ""autograph""]"	Elvis Presley signing autograph	Elvis Presley signing autograph	PROPN PROPN VERB NOUN	compound nsubj ROOT dobj
552	I completed the Fisherman Savior quest in Mysterior	"[""I"", ""completed"", ""the"", ""Fisherman"", ""Savior"", ""quest"", ""in"", ""Mysterior""]"	I completed the Fisherman Savior quest in Mysterior	I completed the Fisherman Savior quest in Mysterior	PRON VERB DET PROPN PROPN NOUN ADP PROPN	nsubj ROOT det compound compound dobj prep pobj
553	Then it wants to start snowing on top of my already shitty day	"[""Then"", ""it"", ""wants"", ""to"", ""start"", ""snowing"", ""on"", ""top"", ""of"", ""my"", ""already"", ""shitty"", ""day""]"	Then it wants to start snowing on top of my already shitty day	Then it wants to start snowing on top of my already shitty day	ADV PRON VERB PART VERB VERB ADP NOUN ADP PRON ADV ADJ NOUN	advmod nsubj ROOT aux xcomp xcomp prep pobj prep poss advmod amod pobj
554	@ddlovato She makes me feel power in even the saddest days!	"[""@ddlovato"", ""She"", ""makes"", ""me"", ""feel"", ""power"", ""in"", ""even"", ""the"", ""saddest"", ""days!""]"	@ddlovato She makes me feel power in even the saddest days!	@ddlovato She makes me feel power in even the saddest days!	PROPN PRON VERB PRON VERB NOUN ADP ADV DET ADJ NOUN PUNCT	ROOT nsubj ROOT nsubj ccomp dobj prep advmod det amod pobj punct
555	The hair on my legs grow back fast af! I just shaved them Sunday!!!!!!!!!	"[""The"", ""hair"", ""on"", ""my"", ""legs"", ""grow"", ""back"", ""fast"", ""af!"", ""I"", ""just"", ""shaved"", ""them"", ""Sunday!!!!!!!!!""]"	The hair on my legs grow back fast af! I just shaved them Sunday!!!!!!!!!	The hair on my legs grow back fast af! I just shaved them Sunday!!!!!!!!!	DET NOUN ADP PRON NOUN VERB ADV ADV ADP PUNCT PRON ADV VERB PRON PROPN PUNCT PUNCT PUNCT PUNCT PUNCT PUNCT PUNCT PUNCT PUNCT	det nsubj prep poss pobj ROOT advmod advmod advmod punct nsubj advmod ROOT dobj npadvmod punct punct punct punct punct punct punct punct punct
556	Strong! like i said. thanks for all the support. We got a big year coming up.	"[""Strong!"", ""like"", ""i"", ""said."", ""thanks"", ""for"", ""all"", ""the"", ""support."", ""We"", ""got"", ""a"", ""big"", ""year"", ""coming"", ""up.""]"	Strong! like i said. thanks for all the support. We got a big year coming up.	Strong! like i said. thanks for all the support. We got a big year coming up.	ADJ PUNCT INTJ PRON VERB PUNCT NOUN ADP DET DET NOUN PUNCT PRON VERB DET ADJ NOUN VERB ADP PUNCT	ROOT punct intj nsubj ROOT punct ROOT prep predet det pobj punct nsubj ROOT det amod dobj acl prt punct
557	Sip coffee daily to prevent eye damage	"[""Sip"", ""coffee"", ""daily"", ""to"", ""prevent"", ""eye"", ""damage""]"	Sip coffee daily to prevent eye damage	Sip coffee daily to prevent eye damage	PROPN NOUN ADV PART VERB NOUN NOUN	compound compound ROOT aux relcl compound dobj
558	I usually don't like tall guys but... @kburton_25 thoooooo\ud83d\ude4c	"[""I"", ""usually"", ""don't"", ""like"", ""tall"", ""guys"", ""but..."", ""@kburton_25"", ""thoooooo\ud83d\ude4c""]"	I usually don't like tall guys but... @kburton_25 thoooooo\ud83d\ude4c	I usually don't like tall guys but... @kburton_25 thoooooo\ud83d\ude4c	PRON ADV AUX PART VERB ADJ NOUN CCONJ PUNCT NOUN X	nsubj advmod aux neg ROOT amod dobj cc punct ccomp punct
559	I wonder if guys ever get insecur	"[""I"", ""wonder"", ""if"", ""guys"", ""ever"", ""get"", ""insecur""]"	I wonder if guys ever get insecur	I wonder if guys ever get insecur	PRON VERB SCONJ NOUN ADV VERB ADJ	nsubj ROOT mark nsubj advmod ccomp ccomp
560	@emzmac_xo no wonder hahahahaha they were steaming and your shouting abuse at a poor innocent man trying to get home from work hahahha	"[""@emzmac_xo"", ""no"", ""wonder"", ""hahahahaha"", ""they"", ""were"", ""steaming"", ""and"", ""your"", ""shouting"", ""abuse"", ""at"", ""a"", ""poor"", ""innocent"", ""man"", ""trying"", ""to"", ""get"", ""home"", ""from"", ""work"", ""hahahha""]"	@emzmac_xo no wonder hahahahaha they were steaming and your shouting abuse at a poor innocent man trying to get home from work hahahha	@emzmac_xo no wonder hahahahaha they were steaming and your shouting abuse at a poor innocent man trying to get home from work hahahha	INTJ DET NOUN PROPN PRON AUX VERB CCONJ PRON NOUN NOUN ADP DET ADJ ADJ NOUN VERB PART VERB ADV ADP NOUN NOUN	advcl det dobj intj nsubj aux ROOT cc poss amod nsubj prep det amod amod pobj conj aux xcomp advmod prep compound pobj
561	Man Utd not naming new boss this week http://t.co/sAUsQRji5v	"[""Man"", ""Utd"", ""not"", ""naming"", ""new"", ""boss"", ""this"", ""week"", ""http://t.co/sAUsQRji5v""]"	Man Utd not naming new boss this week http://t.co/sAUsQRji5v	Man Utd not naming new boss this week http://t.co/sAUsQRji5v	PROPN PROPN PART VERB ADJ NOUN DET NOUN NOUN	compound nsubj neg ROOT amod dobj det npadvmod npadvmod
562	Happy birthday to my main man @ScooterMcGavin8 #growingup #19	"[""Happy"", ""birthday"", ""to"", ""my"", ""main"", ""man"", ""@ScooterMcGavin8"", ""#growingup""]"	Happy birthday to my main man @ScooterMcGavin8 #growingup #19	Happy birthday to my main man @ScooterMcGavin8 #growingup #19	ADJ NOUN ADP PRON ADJ NOUN PUNCT SYM VERB SYM NUM	amod nsubj prep poss amod pobj punct dep ROOT nmod dobj
563	RT @reviewjournal: Fla. man files class-action lawsuit over receiving text msgs. from Las Vegas show. http://t.co/KeqJhnHbdY	"[""RT"", ""@reviewjournal:"", ""Fla."", ""man"", ""files"", ""class-action"", ""lawsuit"", ""over"", ""receiving"", ""text"", ""msgs."", ""from"", ""Las"", ""Vegas"", ""show."", ""http://t.co/KeqJhnHbdY""]"	RT @reviewjournal: Fla. man files class-action lawsuit over receiving text msgs. from Las Vegas show. http://t.co/KeqJhnHbdY	RT @reviewjournal: Fla. man files class-action lawsuit over receiving text msgs. from Las Vegas show. http://t.co/KeqJhnHbdY	PROPN PROPN PUNCT PROPN NOUN VERB NOUN PUNCT NOUN NOUN ADP VERB NOUN PROPN PUNCT ADP PROPN PROPN NOUN PUNCT X	compound dep punct compound nsubj ROOT compound punct compound dobj prep pcomp compound dobj punct ROOT compound compound pobj punct ROOT
564	RT @coolfunnytshirt: Ashutosh: I am a Man tanning in peace.. \n\nKejri : Abe	"[""RT"", ""@coolfunnytshirt:"", ""Ashutosh:"", ""I"", ""am"", ""a"", ""Man"", ""tanning"", ""in"", ""peace.."", ""\n\nKejri"", ""Abe""]"	RT @coolfunnytshirt: Ashutosh: I am a Man tanning in peace.. \n\nKejri : Abe	RT @coolfunnytshirt: Ashutosh: I am a Man tanning in peace.. \n\nKejri : Abe	PROPN PROPN PUNCT PROPN PUNCT PRON AUX DET PROPN NOUN ADP NOUN PUNCT ADV PUNCT PROPN	compound nmod punct dep punct nsubj ROOT det compound attr prep pobj punct dep punct ROOT
565	It's nearly impossible to contain your exuberant self-expression	"[""It's"", ""nearly"", ""impossible"", ""to"", ""contain"", ""your"", ""exuberant"", ""self-expression""]"	It's nearly impossible to contain your exuberant self-expression	It's nearly impossible to contain your exuberant self-expression	PRON AUX ADV ADJ PART VERB PRON ADJ NOUN PUNCT NOUN	nsubj ROOT advmod acomp aux xcomp poss amod compound punct dobj
566	@theblondeabroad A return flight to see you? ;-)	"[""@theblondeabroad"", ""A"", ""return"", ""flight"", ""to"", ""see"", ""you?""]"	@theblondeabroad A return flight to see you? ;-)	@theblondeabroad A return flight to see you? ;-)	X DET NOUN NOUN PART VERB PRON PUNCT PUNCT	ROOT det compound ROOT aux relcl dobj punct punct
567	@WomanDoItAll: Don't stress. Do your best. Forget the rest.	"[""@WomanDoItAll:"", ""Don't"", ""stress."", ""Do"", ""your"", ""best."", ""Forget"", ""the"", ""rest.""]"	@WomanDoItAll: Don't stress. Do your best. Forget the rest.	@WomanDoItAll: Don't stress. Do your best. Forget the rest.	AUX PUNCT AUX PART VERB PUNCT VERB PRON ADJ PUNCT VERB DET NOUN PUNCT	aux punct aux neg ROOT punct ROOT poss dobj punct ROOT det dobj punct
568	Cullen's always been right when he gives his advice to me	"[""Cullen's"", ""always"", ""been"", ""right"", ""when"", ""he"", ""gives"", ""his"", ""advice"", ""to"", ""me""]"	Cullen's always been right when he gives his advice to me	Cullen's always been right when he gives his advice to me	PROPN PART ADV AUX ADJ SCONJ PRON VERB PRON NOUN ADP PRON	nsubj case advmod ROOT acomp advmod nsubj advcl poss dobj dative pobj
569	I would jump off a 50ft ladder in happiness id do it just id prob jump off the 1st step	"[""I"", ""would"", ""jump"", ""off"", ""a"", ""50ft"", ""ladder"", ""in"", ""happiness"", ""id"", ""do"", ""it"", ""just"", ""id"", ""prob"", ""jump"", ""off"", ""the"", ""1st"", ""step""]"	I would jump off a 50ft ladder in happiness id do it just id prob jump off the 1st step	I would jump off a 50ft ladder in happiness id do it just id prob jump off the 1st step	PRON AUX VERB ADP DET NUM NOUN NOUN ADP NOUN PROPN PROPN VERB PRON ADV PROPN PROPN NOUN VERB ADP DET ADJ NOUN	nsubj aux ccomp prt det nummod compound dobj prep pobj compound nsubj ROOT nsubj advmod compound compound nsubj ccomp prep det amod npadvmod
570	What the hell is happening?	"[""What"", ""the"", ""hell"", ""is"", ""happening?""]"	What the hell is happening?	What the hell is happening?	PRON DET NOUN AUX VERB PUNCT	dobj det nsubj aux ROOT punct
571	@DanPatrick actually that's not your place to say!!!	"[""@DanPatrick"", ""actually"", ""that's"", ""not"", ""your"", ""place"", ""to"", ""say!!!""]"	@DanPatrick actually that's not your place to say!!!	@DanPatrick actually that's not your place to say!!!	VERB ADV PRON AUX PART PRON NOUN PART VERB PUNCT PUNCT PUNCT	advcl advmod nsubj ROOT neg poss attr aux relcl punct punct punct
